{
  "benchmarkVersion": "recall_safety_benchmark_v2",
  "datasetVersion": "2.0.0",
  "policyVersion": "phase_15_safety_policy_v1",
  "sourceSnapshotVersion": "2.0.0",
  "split": "holdout",
  "createdAt": "2026-09-20",
  "cases": [
    {
      "caseId": "p15-hol-13-1",
      "authority": "CPSC",
      "sourceKey": "cpsc:10213",
      "externalRecallId": "10213",
      "officialUrl": "https://www.cpsc.gov/Recalls/2025/LaRose-Industries-Recalls-Cra-Z-Art-Gemex-Gel2Gem-Jewelry-Kits-Due-to-Risk-of-Skin-Eye-and-Respiratory-Irritation-and-Sensitization-Violation-of-the-Federal-Hazardous-Substances-Act",
      "referenceDate": "2026-09-20",
      "recallFamilyId": "cpsc-family-10213",
      "split": "holdout",
      "expected": "match",
      "labelProvenance": "official_exact_evidence",
      "evidenceDimensions": ["gtin"],
      "perturbationType": null,
      "pairGroupId": "p15-pair-10213",
      "hardNegative": false,
      "ownedProduct": {
        "productName": "Cra-Z-Art Gemex/Gel2Gem Jewelry Kits",
        "brand": "Cra-Z-Art",
        "category": "consumer_product",
        "gtin": "884920250697",
        "modelNumber": null,
        "serialNumber": null,
        "lotNumber": null,
        "purchaseDate": null,
        "identificationMethod": "controlled_benchmark_fixture"
      },
      "attributes": {},
      "reason": "All explicit authoritative scope conditions represented in this controlled product are satisfied.",
      "notes": "Controlled benchmark object only; contains no user inventory or personal data."
    },
    {
      "caseId": "p15-hol-13-2",
      "authority": "CPSC",
      "sourceKey": "cpsc:10213",
      "externalRecallId": "10213",
      "officialUrl": "https://www.cpsc.gov/Recalls/2025/LaRose-Industries-Recalls-Cra-Z-Art-Gemex-Gel2Gem-Jewelry-Kits-Due-to-Risk-of-Skin-Eye-and-Respiratory-Irritation-and-Sensitization-Violation-of-the-Federal-Hazardous-Substances-Act",
      "referenceDate": "2026-09-20",
      "recallFamilyId": "cpsc-family-10213",
      "split": "holdout",
      "expected": "no_match",
      "labelProvenance": "controlled_identifier_counterfactual",
      "evidenceDimensions": ["gtin"],
      "perturbationType": "valid_gtin_near_miss",
      "pairGroupId": "p15-pair-10213",
      "hardNegative": true,
      "ownedProduct": {
        "productName": "Cra-Z-Art Gemex/Gel2Gem Jewelry Kits",
        "brand": "Cra-Z-Art",
        "category": "consumer_product",
        "gtin": "884920250796",
        "modelNumber": null,
        "serialNumber": null,
        "lotNumber": null,
        "purchaseDate": null,
        "identificationMethod": "controlled_benchmark_fixture"
      },
      "attributes": {},
      "reason": "A minimal controlled change crosses an explicit authoritative scope boundary.",
      "notes": "Controlled benchmark object only; contains no user inventory or personal data."
    },
    {
      "caseId": "p15-hol-13-3",
      "authority": "CPSC",
      "sourceKey": "cpsc:10213",
      "externalRecallId": "10213",
      "officialUrl": "https://www.cpsc.gov/Recalls/2025/LaRose-Industries-Recalls-Cra-Z-Art-Gemex-Gel2Gem-Jewelry-Kits-Due-to-Risk-of-Skin-Eye-and-Respiratory-Irritation-and-Sensitization-Violation-of-the-Federal-Hazardous-Substances-Act",
      "referenceDate": "2026-09-20",
      "recallFamilyId": "cpsc-family-10213",
      "split": "holdout",
      "expected": "needs_review",
      "labelProvenance": "source_ambiguity",
      "evidenceDimensions": ["gtin"],
      "perturbationType": "missing_required_identifier",
      "pairGroupId": null,
      "hardNegative": false,
      "ownedProduct": {
        "productName": "Cra-Z-Art Gemex/Gel2Gem Jewelry Kits",
        "brand": "Cra-Z-Art",
        "category": "consumer_product",
        "gtin": null,
        "modelNumber": null,
        "serialNumber": null,
        "lotNumber": null,
        "purchaseDate": null,
        "identificationMethod": "controlled_benchmark_fixture"
      },
      "attributes": {},
      "reason": "Required authoritative identifying evidence is absent; the safe outcome is abstention.",
      "notes": "Controlled benchmark object only; contains no user inventory or personal data."
    },
    {
      "caseId": "p15-hol-13-4",
      "authority": "CPSC",
      "sourceKey": "cpsc:10213",
      "externalRecallId": "10213",
      "officialUrl": "https://www.cpsc.gov/Recalls/2025/LaRose-Industries-Recalls-Cra-Z-Art-Gemex-Gel2Gem-Jewelry-Kits-Due-to-Risk-of-Skin-Eye-and-Respiratory-Irritation-and-Sensitization-Violation-of-the-Federal-Hazardous-Substances-Act",
      "referenceDate": "2026-09-20",
      "recallFamilyId": "cpsc-family-10213",
      "split": "holdout",
      "expected": "match",
      "labelProvenance": "official_exact_evidence",
      "evidenceDimensions": ["gtin"],
      "perturbationType": null,
      "pairGroupId": null,
      "hardNegative": false,
      "ownedProduct": {
        "productName": "Cra-Z-Art Gemex/Gel2Gem Jewelry Kits — label transcription",
        "brand": "Cra-Z-Art",
        "category": "consumer_product",
        "gtin": "884920250697",
        "modelNumber": null,
        "serialNumber": null,
        "lotNumber": null,
        "purchaseDate": null,
        "identificationMethod": "controlled_benchmark_fixture"
      },
      "attributes": {},
      "reason": "All explicit authoritative scope conditions represented in this controlled product are satisfied.",
      "notes": "Controlled benchmark object only; contains no user inventory or personal data."
    },
    {
      "caseId": "p15-hol-14-1",
      "authority": "CPSC",
      "sourceKey": "cpsc:10207",
      "externalRecallId": "10207",
      "officialUrl": "https://www.cpsc.gov/Recalls/2025/Woolite-Delicates-Detergent-Recalled-by-Reckitt-Due-to-Risk-of-Exposure-to-Bacteria-Sold-Exclusively-on-Amazon-com",
      "referenceDate": "2026-09-20",
      "recallFamilyId": "cpsc-family-10207",
      "split": "holdout",
      "expected": "match",
      "labelProvenance": "official_exact_evidence",
      "evidenceDimensions": ["gtin"],
      "perturbationType": null,
      "pairGroupId": "p15-pair-10207",
      "hardNegative": false,
      "ownedProduct": {
        "productName": "Woolite Delicates detergent in 50-fluid-ounce bottles",
        "brand": "Woolite",
        "category": "consumer_product",
        "gtin": "062338727240",
        "modelNumber": null,
        "serialNumber": null,
        "lotNumber": null,
        "purchaseDate": null,
        "identificationMethod": "controlled_benchmark_fixture"
      },
      "attributes": {},
      "reason": "All explicit authoritative scope conditions represented in this controlled product are satisfied.",
      "notes": "Controlled benchmark object only; contains no user inventory or personal data."
    },
    {
      "caseId": "p15-hol-14-2",
      "authority": "CPSC",
      "sourceKey": "cpsc:10207",
      "externalRecallId": "10207",
      "officialUrl": "https://www.cpsc.gov/Recalls/2025/Woolite-Delicates-Detergent-Recalled-by-Reckitt-Due-to-Risk-of-Exposure-to-Bacteria-Sold-Exclusively-on-Amazon-com",
      "referenceDate": "2026-09-20",
      "recallFamilyId": "cpsc-family-10207",
      "split": "holdout",
      "expected": "no_match",
      "labelProvenance": "controlled_identifier_counterfactual",
      "evidenceDimensions": ["gtin"],
      "perturbationType": "valid_gtin_near_miss",
      "pairGroupId": "p15-pair-10207",
      "hardNegative": true,
      "ownedProduct": {
        "productName": "Woolite Delicates detergent in 50-fluid-ounce bottles",
        "brand": "Woolite",
        "category": "consumer_product",
        "gtin": "062338727349",
        "modelNumber": null,
        "serialNumber": null,
        "lotNumber": null,
        "purchaseDate": null,
        "identificationMethod": "controlled_benchmark_fixture"
      },
      "attributes": {},
      "reason": "A minimal controlled change crosses an explicit authoritative scope boundary.",
      "notes": "Controlled benchmark object only; contains no user inventory or personal data."
    },
    {
      "caseId": "p15-hol-14-3",
      "authority": "CPSC",
      "sourceKey": "cpsc:10207",
      "externalRecallId": "10207",
      "officialUrl": "https://www.cpsc.gov/Recalls/2025/Woolite-Delicates-Detergent-Recalled-by-Reckitt-Due-to-Risk-of-Exposure-to-Bacteria-Sold-Exclusively-on-Amazon-com",
      "referenceDate": "2026-09-20",
      "recallFamilyId": "cpsc-family-10207",
      "split": "holdout",
      "expected": "needs_review",
      "labelProvenance": "source_ambiguity",
      "evidenceDimensions": ["gtin"],
      "perturbationType": "missing_required_identifier",
      "pairGroupId": null,
      "hardNegative": false,
      "ownedProduct": {
        "productName": "Woolite Delicates detergent in 50-fluid-ounce bottles",
        "brand": "Woolite",
        "category": "consumer_product",
        "gtin": null,
        "modelNumber": null,
        "serialNumber": null,
        "lotNumber": null,
        "purchaseDate": null,
        "identificationMethod": "controlled_benchmark_fixture"
      },
      "attributes": {},
      "reason": "Required authoritative identifying evidence is absent; the safe outcome is abstention.",
      "notes": "Controlled benchmark object only; contains no user inventory or personal data."
    },
    {
      "caseId": "p15-hol-14-4",
      "authority": "CPSC",
      "sourceKey": "cpsc:10207",
      "externalRecallId": "10207",
      "officialUrl": "https://www.cpsc.gov/Recalls/2025/Woolite-Delicates-Detergent-Recalled-by-Reckitt-Due-to-Risk-of-Exposure-to-Bacteria-Sold-Exclusively-on-Amazon-com",
      "referenceDate": "2026-09-20",
      "recallFamilyId": "cpsc-family-10207",
      "split": "holdout",
      "expected": "no_match",
      "labelProvenance": "controlled_identifier_counterfactual",
      "evidenceDimensions": ["gtin"],
      "perturbationType": "valid_gtin_near_miss",
      "pairGroupId": null,
      "hardNegative": true,